n,links,paragrafos_resgatados,texto_completo
55,https://www1.folha.uol.com.br/cotidiano/2023/04/mais-atencao-a-sinais-de-alerta-pode-prevenir-ataques-a-escolas-diz-especialista.shtml,"['Atiradores psicóticos sofrem de transtornos de personalidade ou de esquizofrenia e apresentam sintomas como alucinações, delírios, desorganização mental e comportamental, com crenças e hábitos considerados excêntricos.']","['Atenção a sinais de alerta pode prevenir ataques a escolas - 14/04/2023 - Cotidiano - Folha', 'Mais atenção a sinais de alerta pode prevenir ataques a escolas, diz especialista', 'Para Peter Langman, psicólogo e autor de três livros sobre autores desse tipo de crime, internet também pode ajudar a detectar ameaças', 'em geral deixam pistas do que pretendem fazer antes de concretizarem seus planos, alerta o psicólogo norte-americano Peter Langman, autor de três livros sobre crianças e adolescentes que cometeram —ou tentaram cometer— o tipo de crime que', 'Esses sinais, diz, não têm nada a ver com o estilo de roupas que esses jovens vestem, o videogame que jogam ou suas preferências musicais. Tampouco estão diretamente relacionados a questões demográficas, como sugere o senso comum ou mesmo a produção de dados estatísticos sobre esses eventos.', 'Pessoas fazem homenagem a professora assassinada por aluno na escola Thomazia Montoro, na zona oeste de São Paulo\n             -', 'Um estudo publicado no ano passado nos EUA apontou que 95% dos autores de ataques a escolas no país são homens, 61% deles, brancos, e que sua idade média é de 15 anos. No mesmo dia em que um adolescente', ', em São Paulo, uma pessoa de 28 anos invadiu sua antiga escola em Nashville, nos EUA, e', 'Langman argumenta que, ainda que não exista um perfil pré-determinado desses criminosos, existem sinais de alerta que precisam ser mais bem decodificados para possibilitar a prevenção de novos ataques.', 'Falso alerta de ataque a escolas pode levar à prisão, diz especialista em direito', 'Dois em cada cinco estudantes no Brasil precisam de apoio psicológico, diz pesquisa', 'O mais elementar deles é a ameaça direta, que muitas vezes é desacreditada e descartada, sem comunicação às autoridades. Em seu livro ""Warning Signs: Identifying School Shooters Before They Strike"" (Sinais de Alerta: Como identificar atiradores de escolas antes do ataque, em tradução livre do inglês), publicado nos EUA em 2021, Langman elenca ações de preparação (estocagem de armas, plantas do edifício escolar e anotações relacionadas a ele) e outros indícios menos evidentes.', '""Sinais de advertência incluem o que é chamado de \'vazamento\', quando os estudantes divulgam suas intenções e falam sobre seus planos de ataque indiretamente"", explica ele à', '. Segundo Langman, que já deu palestra sobre o tema para agentes do FBI, isso pode ocorrer na forma de anúncios dos ataques a amigos ou em redes sociais.', '""Eles podem se gabar sobre o que pretendem fazer, convidar alguém para a ação planejada ou ainda advertir amigos para que fiquem longe da escola em determinada data para não se machucarem"", descreve. ""Estes sinais precisam ser comunicados à escola e às autoridades de segurança pública.""', 'Para o psicólogo, outro sinal são comentários favoráveis ou positivos em relação a ataques ocorridos e noticiados. A manifestação pública de que esses atos seriam ""aceitáveis"", ""admiráveis"" ou mesmo considerados como ""necessários"" deve ser considerada como um alerta, segundo o especialista.', 'Langman diz que, embora as redes sociais possam contribuir para o chamado', ', em que a informação sobre um ataque pode atuar como gatilho para outros jovens deflagrarem planos similares, elas também ajudaram a evitar a concretização desses atos. ""Ataques foram evitados porque as pessoas viram postagens sobre pessoas que pretendiam cometer esses crimes e alertaram as autoridades, que foram capazes de intervir antes que o ataque ocorresse"", relata.', 'O psicólogo Peter Langman, especialista em perpetradores de ataques a escolas nos EUA, durante palestra no FBI.\n             -', 'O psicólogo, que hoje faz parte do conselho da Associação Nacional de Intervenção Comportamental e Avaliação de Ameaças dos EUA, trabalhava num hospital psiquiátrico para crianças e jovens no estado da Pensilvânia (EUA) em 1999 quando ocorreu o', '""Dez dias após esse incidente, um atirador de escola em potencial foi internado no hospital e fui eu quem fez uma avaliação psicológica dele"", lembra. ""Depois, chegou outro atirador em potencial, e outro. E esse se tornou objeto da minha pesquisa.""', 'Em seu primeiro livro sobre o tema, de 2009, Langman estudou a história e o perfil psicológico de vários jovens que atacaram escolas e identificou três perfis recorrentes: o traumatizado, o psicopata e o psicótico.', 'De acordo com essa tipologia, atiradores traumatizados são aqueles que cresceram em famílias disfuncionais, caracterizadas por abusos de drogas e álcool pelos pais, violência doméstica, abuso físico ou sexual e negligência.', 'Atiradores psicóticos sofrem de transtornos de personalidade ou de esquizofrenia e apresentam sintomas como alucinações, delírios, desorganização mental e comportamental, com crenças e hábitos considerados excêntricos.', 'Já os atiradores psicopatas têm perfil narcisista e autorreferente, não manifestam empatia pelo próximo e, por vezes, são sádicos.', '""É importante reconhecer que a maioria das pessoas nestas três categorias nunca vai matar ninguém. E que a tipologia é crucial para entendermos os perpetradores, mas que por si só ela não é responsável por seus ataques"", pondera. Para Langman, muitos outros fatores podem contribuir para que esses jovens se tornem violentos.', 'Especialistas afirmam que ameaças não devem ser ignoradas. Por isso, é importante que os pais e escolas procurem a Polícia Civil e canais criados pelo Ministério da Justiça para denunciar qualquer tipo de ameaça', 'As autoridades precisam ser notificadas sobre qualquer tipo de ameaça, pois quem as produz ou compartilha também pode responder criminalmente', 'Pais, alunos e escolas devem manter diálogo estreito sobre alertas, receios e medidas adotadas. A transparência das ações é importante para aumentar a sensação de segurança', 'Fique atento e informe ao colégio qualquer mudança no comportamento dos alunos', 'Como parte da Operação Escola Segura, o Ministério da Justiça lançou um canal no site para que sejam denunciados sites, blogs e publicações nas redes sociais. O site para denúncia é o', 'Em São Paulo, no caso de ameaça, é possível ligar para o 181, canal da polícia que permite que qualquer pessoa forneça à polícia informações sobre delitos e formas de violência, com garantia de anonimato', 'Você já conhece as vantagens de ser assinante da Folha?Além de ter acesso a reportagens e colunas, você conta com newsletters exclusivas (', 'para receber alertas das principais notícias do dia.A sua assinatura nos ajuda a fazer um jornalismo independente e de qualidade. Obrigado!', 'Mais de 180 reportagens e análises publicadas a cada dia. Um time com mais de 200 colunistas e blogueiros. Um jornalismo profissional que fiscaliza o poder público, veicula notícias proveitosas e inspiradoras, faz contraponto à intolerância das redes sociais e traça uma linha clara entre verdade e mentira. Quanto custa ajudar a produzir esse conteúdo?', 'https://www1.folha.uol.com.br/cotidiano/2023/04/mais-atencao-a-sinais-de-alerta-pode-prevenir-ataques-a-escolas-diz-especialista.shtml', 'Os comentários não representam a opinião do jornal; a responsabilidade é do autor da mensagem.', 'Polícia prende estudante apontado como mentor de mensagens sobre ataques a escolas', 'Alckmin defende punição para redes que mantiverem conteúdo que estimula ataques', 'Compartilhar índice folha de mobilidade urbana: Série de reportagens mostra nível de mobilidade urbana das capitais', 'Compartilhar gênero: feminino: Série da Folha conta histórias sobre violência contra a mulher no Brasil', 'Série da Folha conta histórias sobre violência contra a mulher no Brasil', 'Prefeitura avança com obras de requalificação na av. Santo Amaro e muda trânsito', 'Para incentivar produção, agricultura familiar terá mais crédito e juros menores', 'Ministro do STF ainda precisa aceitar e homologar compromisso para ele ter validade', 'Caso das 10 Mil: podcast narra história das mulheres investigadas por aborto em MS', 'Além de enfrentarem processo judicial, pacientes lidaram com implicações sociais e estigma', ""Lula tem 7 de Setembro com chefes de Poderes, Zé Gotinha e 'climão' um dia após reforma"", 'Governo tenta atenuar insatisfação de aliados com trocas ministeriais para ampliar os espaços do centrão', 'Copyright Folha de S.Paulo. Todos os direitos reservados. É proibida a reprodução do conteúdo desta página em qualquer meio de comunicação, eletrônico ou impresso, sem autorização escrita da Folhapress.', 'Empresa Folha da Manhã S.A. - Grupo Folha - Copyright Folha de S.Paulo (1921 - 2023)', 'Folha de S.Paulo é publicado pela Empresa Folha da Manhã S.A. CNPJ: 60.579.703/0001-48', 'Copyright Folha de S.Paulo. Todos os direitos reservados. É proibida a reprodução do conteúdo desta página em qualquer meio de comunicação, eletrônico ou impresso, sem autorização escrita da']"
56,https://www1.folha.uol.com.br/ciencia/2023/04/genoma-humano-o-mapa-mais-importante-do-mundo.shtml,"['Esse uso rotineiro da tecnologia genética na prática clínica seria o maior benefício decorrente do PGH. Ele dá um exemplo: ""Nos últimos anos de grandes estudos de sequenciamento, encontramos o primeiro gene da esquizofrenia. Agora temos dez: se eles são danificados, o risco aumenta enormemente.""', 'Tal volume, e o fato de não se saber como esses fatores contribuem para ela, representam um desafio real para a medicina: há quem tenha a mutação sem apresentar esquizofrenia, ou desenvolve outra doença completamente diferente. ""Toda a relação entre mutação genética e doença ficou mais precária"" desde o sequenciamento genômico, admite Curtis.']","['Genoma humano, o mapa mais importante do mundo - 14/04/2023 - Ciência - Folha', 'Ao ser publicado, 20 anos atrás, sequenciamento do genoma humano revolucionou a ciência, repercutindo da medicina à antropologia', 'Em 14 de abril de 2003, uma equipe científica internacional publicou o primeiro sequenciamento do', '. O mapa, consistindo de 3 bilhões de unidades de DNA, constituía basicamente a ""planta"" de um ser humano. Embora montado com fragmentos genéticos de diversos indivíduos e ainda parcialmente incompleto, o PGH (Projeto Genoma Humano) era uma conquista monumental da tecnologia e da', 'trazia numerosas promessas, como desvendar histórias humanas ancestrais e descobrir o papel dos genes nas enfermidades. Como numa bola de cristal, seria possível prever enfermidades futuras e desenvolver de antemão as terapias para tratá-las.', 'As tecnologias genômicas transformaram a compreensão das doenças humanas, da história evolutiva e do que significa ser humano\n             -', 'Algumas dessas promessas se cumpriram, outras eram fantasiosas. Mas havia sido dada a partida para uma revolução das ciências biológicas: as tecnologias genômicas transformaram a compreensão das doenças humanas, da história evolutiva e do que significa ser humano.', 'A medicina genômica é uma mola-mestra dessa revolução científica. Tendo-se sequenciado o genoma de mais de 1 milhão de indivíduos desde 2003, é possível avaliar como as variações genéticas determinam o risco individual para certas doenças.', '""A ideia de que se pode obter toda a sequência genômica de um bebê em alguns dias e entender por que ele está doente, é notável"", comenta David Curtis, professor de medicina genética da', 'Esse uso rotineiro da tecnologia genética na prática clínica seria o maior benefício decorrente do PGH. Ele dá um exemplo: ""Nos últimos anos de grandes estudos de sequenciamento, encontramos o primeiro gene da esquizofrenia. Agora temos dez: se eles são danificados, o risco aumenta enormemente.""', 'Encontraram-se também genes mutantes relacionados ao câncer, doenças cardíacas, diabetes e muitas outras. O outro grande benefício é poder desenvolver novas terapias analisando as mutações genéticas em laboratório. Já se registraram sucessos, por exemplo, ao recondicionar anticorpos para combaterem o câncer; ou no uso de ferramentas CRISPR-Cas9 de edição genética para tratar a anemia falciforme.', 'Entretanto essa onda de inovação também mostrou os limites da medicina genética, pois os genes são apenas um fator na evolução de uma enfermidade, e poucas doenças hereditárias são causadas pela mutação de um único gene.', ', em que apenas 1% dos portadores apresenta mutação em um dos dez genes identificados: ao todo há mais de 250 ""fatores de risco"" genéticos para a doença mental.', 'Tal volume, e o fato de não se saber como esses fatores contribuem para ela, representam um desafio real para a medicina: há quem tenha a mutação sem apresentar esquizofrenia, ou desenvolve outra doença completamente diferente. ""Toda a relação entre mutação genética e doença ficou mais precária"" desde o sequenciamento genômico, admite Curtis.', 'Não obstante, o projeto foi inegavelmente pioneiro na biologia evolutiva. ""Podemos comparar a sequência do genoma humano à de nossos parentes próximos, e situar nossa espécie nesse contexto evolutivo mais amplo. Isso mostrou que a história humana é muito mais dinâmica do que se poderia ter previsto"", resume Anders Bergstrom, biólogo evolutivo da Universidade de East Anglia, no', 'O exame das sequências de humanos modernos e de subespécies extintas mostrou que os ancestrais humanos se cruzaram com outros hominídeos, como o Neandertal e o de Denisova. O conhecimento sobre as vidas das comunidades de Homo neanderthalensis, na Europa Central, fornece pistas sobre seu declínio populacional; e agora se sabe sobre o legado genético de povos há muito extintos – como a dos minoicos nos habitantes modernos de Creta.', 'Estudando DNA antigo e os pequenos vestígios dos ancestrais dentro dos indivíduos modernos, se compreende como a espécie humana se propagou pelo mundo, levou progressos culturais a terras distantes, como a agricultura, e, no caminho, desenvolveu resistência a numerosas doenças.', 'Mas as maiores perguntas relativas à genética ainda estão por ser respondidas. Uma é: o que faz 99% do genoma, se apenas 1% codifica proteínas? Mas para Bergstrom, a maior questão que a ciência pode responder é o que constitui um ser humano, uma vez que ""quase todo o progresso na genética, nos últimos 20 anos, se refere às diferenças entre os seres humanos, mas não nos diz o que é universal entre nós"".', 'O sequenciamento do genoma mudou a forma como os humanos se veem, mas sobretudo ao dar respaldo científico à ideia de individualismo. Corre a noção de que cada um possui um código genético próprio (nem mesmo gêmeos idênticos compartilham o mesmo). Portanto identificar das mínimas variações genéticas entre os indivíduos revelaria o que torna cada um, único.', 'Em grande parte dos casos, essa abordagem é produtiva. O sequenciamento mostrou, por exemplo, que ""raça"" é uma construção social sem base na genética, pois há mais variação dentro dos grupos raciais do que entre eles. No entanto, ficar sempre procurando diferenças faz perder de vista o que é ser coletivamente humanos, em vez de 8 bilhões de seres simiescos no mesmo planeta.', 'Sabe-se, por exemplo, que há 96% de similaridade genética com os chimpanzés, mas não se entende como os 4% de diferença torna alguns mais ""humanos"" do que seus primos catadores de piolhos. ""É uma questão fundamental"", comenta Bergstrom. ʺO que nos torna humanos e únicos enquanto espécie?""', 'O progresso alcançado nas últimas duas décadas não tem sido sem ressalvas: embora, até o momento, se tenham sequenciado mais de 1 milhão de genomas, 92,5% dos dados são originários de indivíduos europeus.', 'Tal análise ""não representou, em absoluto, a diversidade entre os humanos"", critica o biólogo Bergstrom. ""Se a nossa ciência é tendenciosa em relação a um tipo particular de ancestralidade, não vamos poder oferecer a mesma qualidade de medicina personalizada a pessoas diferentes.""', 'Mas os tempos estão mudando: como deixa claro o seu nome, o Nigerian 100K Genome Project visa sequenciar 100 mil genomas na Nigéria, como subsídio para a pesquisa de doenças não transmissíveis. Iniciativas similares estão em curso em outras partes da África, na Ásia e na América do Sul. A esperança é que mais experiência e tecnologias de sequenciamento genômico mais baratas vão trazer benefícios a toda a humanidade.', 'Você já conhece as vantagens de ser assinante da Folha?Além de ter acesso a reportagens e colunas, você conta com newsletters exclusivas (', 'para receber alertas das principais notícias do dia.A sua assinatura nos ajuda a fazer um jornalismo independente e de qualidade. Obrigado!', 'Mais de 180 reportagens e análises publicadas a cada dia. Um time com mais de 200 colunistas e blogueiros. Um jornalismo profissional que fiscaliza o poder público, veicula notícias proveitosas e inspiradoras, faz contraponto à intolerância das redes sociais e traça uma linha clara entre verdade e mentira. Quanto custa ajudar a produzir esse conteúdo?', 'https://www1.folha.uol.com.br/ciencia/2023/04/genoma-humano-o-mapa-mais-importante-do-mundo.shtml', 'Os comentários não representam a opinião do jornal; a responsabilidade é do autor da mensagem.', 'Costa Suaíli já se conectava com redes globais de comércio bem antes de Vasco da Gama', 'Chances de trazer mamute e dodô de volta à vida são baixas, segundo cientistas', 'Compartilhar calculadora: Match ajuda a avaliar a sua saúde e aponta como melhorar', 'Compartilhar mensageiro sideral: Fique por dentro das descobertas da astronomia, dos voos ao espaço e muito mais', 'Fique por dentro das descobertas da astronomia, dos voos ao espaço e muito mais', 'Estrela capaz de formar o tipo de ímã mais poderoso do Universo é identificada', 'Ministro do STF ainda precisa aceitar e homologar compromisso para ele ter validade', 'Caso das 10 Mil: podcast narra história das mulheres investigadas por aborto em MS', 'Além de enfrentarem processo judicial, pacientes lidaram com implicações sociais e estigma', ""Lula tem 7 de Setembro com chefes de Poderes, Zé Gotinha e 'climão' um dia após reforma"", 'Governo tenta atenuar insatisfação de aliados com trocas ministeriais para ampliar os espaços do centrão', 'Empresa Folha da Manhã S.A. - Grupo Folha - Copyright Folha de S.Paulo (1921 - 2023)', 'Folha de S.Paulo é publicado pela Empresa Folha da Manhã S.A. CNPJ: 60.579.703/0001-48', 'Copyright Folha de S.Paulo. Todos os direitos reservados. É proibida a reprodução do conteúdo desta página em qualquer meio de comunicação, eletrônico ou impresso, sem autorização escrita da']"
57,https://www1.folha.uol.com.br/cotidiano/2023/04/ministerio-publico-pede-que-a-uniao-pague-r-128-milhoes-por-morte-de-genivaldo.shtml,"['pela morte de Genivaldo, um homem negro, de 38 anos, diagnosticado com esquizofrenia e que deixou mãe, mulher, 11 irmãos, um filho e um enteado.']","['Caso Genivaldo: MP pede R$ 128 milhões de indenização - 04/04/2023 - Cotidiano - Folha', 'Ministério Público pede que a União pague R$ 128 milhões por morte de Genivaldo', 'O valor é baseado no caso de George Floyd, morto pela polícia nos Estados Unidos', 'O MPF (Ministério Público Federal) emitiu parecer favorável à condenação da União pelo assassinato de', 'No parecer, o MPF pede que a União seja condenada a pagar uma indenização de 128 milhões. O valor tem como parâmetro o', ', morto aos 46 anos depois de ter sido algemado e ter o pescoço prensado contra o chão pelo joelho de um policial em Minnesota, nos Estados Unidos, em maio de 2020.', 'pela morte de Genivaldo, um homem negro, de 38 anos, diagnosticado com esquizofrenia e que deixou mãe, mulher, 11 irmãos, um filho e um enteado.', 'Mulher segura placa com pedido de justiça para Genivaldo durante protesto em São Paulo em de junho de 2022\n             -', 'O MPF concordou com o valor do pedido de indenização proposto na ação civil pública apresentada pela', 'e pelo Centro Santo Dias de Direitos Humanos. Para isso, levou em conta aspectos como a gravidade e repercussão dos fatos, o caráter punitivo e pedagógico da condenação em danos morais.', 'O advogado Marlon Reis, que representa a Educafro e o Centro Santo Dias, afirma que a intenção é destinar os recursos para o Fundo Nacional dos Direitos Difusos para que eles sejam usados na promoção da igualdade racial.', 'Receba no seu email as notícias sobre o cenário jurídico e conteúdos exclusivos: análise, dicas e eventos; exclusiva para assinantes.', 'O parecer do MPF também pede à União uma série de medidas, como a submissão de todos os policiais rodoviários federais a cursos sobre uso progressivo e proporcional da força e', '""A União manifestou o propósito de discutir com as entidades da sociedade civil a celebração de um acordo para por fim ao processo"", informa Marlon Reis. ""As entidades estão abertas ao diálogo. O maior propósito é o que a Polícia Rodoviária Federal passe por um profundo processo de reestruturação a partir desse trágico crime"".', 'em relação a esse processo. ""A ação proposta pelas entidades tem o objetivo de assegurar os direitos coletivos da população brasileira em relação à PRF, a fim de que fatos como esse não venham a se repetir"", explica.', ', determinou ao secretário nacional de Acesso à Justiça, Marivaldo Pereira, que adote as providências para a indenização da família.', 'Você já conhece as vantagens de ser assinante da Folha?Além de ter acesso a reportagens e colunas, você conta com newsletters exclusivas (', 'para receber alertas das principais notícias do dia.A sua assinatura nos ajuda a fazer um jornalismo independente e de qualidade. Obrigado!', 'Mais de 180 reportagens e análises publicadas a cada dia. Um time com mais de 200 colunistas e blogueiros. Um jornalismo profissional que fiscaliza o poder público, veicula notícias proveitosas e inspiradoras, faz contraponto à intolerância das redes sociais e traça uma linha clara entre verdade e mentira. Quanto custa ajudar a produzir esse conteúdo?', 'https://www1.folha.uol.com.br/cotidiano/2023/04/ministerio-publico-pede-que-a-uniao-pague-r-128-milhoes-por-morte-de-genivaldo.shtml', 'Os comentários não representam a opinião do jornal; a responsabilidade é do autor da mensagem.', 'Audiências de custódia enfrentam resistência e falta de estrutura no Brasil', 'STF derruba por unanimidade prisão especial para quem tem curso superior', 'Justiça manda Vale e BHP depositarem R$ 10,3 bi para recuperar cidades no ES', 'Compartilhar índice folha de mobilidade urbana: Série de reportagens mostra nível de mobilidade urbana das capitais', 'Compartilhar gênero: feminino: Série da Folha conta histórias sobre violência contra a mulher no Brasil', 'Série da Folha conta histórias sobre violência contra a mulher no Brasil', 'Prefeitura avança com obras de requalificação na av. Santo Amaro e muda trânsito', 'Para incentivar produção, agricultura familiar terá mais crédito e juros menores', 'Ministro do STF ainda precisa aceitar e homologar compromisso para ele ter validade', 'Caso das 10 Mil: podcast narra história das mulheres investigadas por aborto em MS', 'Além de enfrentarem processo judicial, pacientes lidaram com implicações sociais e estigma', ""Lula tem 7 de Setembro com chefes de Poderes, Zé Gotinha e 'climão' um dia após reforma"", 'Governo tenta atenuar insatisfação de aliados com trocas ministeriais para ampliar os espaços do centrão', 'Empresa Folha da Manhã S.A. - Grupo Folha - Copyright Folha de S.Paulo (1921 - 2023)', 'Folha de S.Paulo é publicado pela Empresa Folha da Manhã S.A. CNPJ: 60.579.703/0001-48', 'Copyright Folha de S.Paulo. Todos os direitos reservados. É proibida a reprodução do conteúdo desta página em qualquer meio de comunicação, eletrônico ou impresso, sem autorização escrita da']"
