n,links,paragrafos_resgatados,texto_completo
0,https://www1.folha.uol.com.br/ilustrada/2023/08/pais-recebe-onda-de-grandes-eventos-culturais-com-the-town-e-sp-arte-veja-lista.shtml,"[', que acontece desde 1951. A edição deste ano, batizada Coreografias do Impossível, traz a diversidade para a pauta com obras como a da artista Stella do Patrocínio, negra, pobre e diagnosticada com esquizofrenia, e a de Arthur Bispo do Rosário, o artista-paciente por excelência, além de muitos outros artistas negros, indígenas e LGBTQIA+.']","['País tem onda de eventos culturais em setembro; veja lista - 29/08/2023 - Ilustrada - Folha', 'País recebe onda de grandes eventos culturais, com The Town e SP-Arte; veja lista', 'Bienal do Livro do Rio de Janeiro, Bienal de São Paulo e ArtRio completam lista que torna o começo de setembro agitado', 'Nesta quarta-feira, dia 30, a SP-Arte Rotas Brasileiras abre uma dupla de semanas preciosa para a cultura no Brasil. Grandes eventos se encadeiam nos próximos dias, contemplando as artes plásticas, que têm destaque, a música e a literatura.', ', feira que busca olhar para a arte produzida ao redor do Brasil e conectar as regiões do país através da cultura, ocupa o pavilhão da Arca, em São Paulo, e conta com a participação de grandes galerias, como a Almeida & Dale, a', ', a Vermelho e a Fortes D’Aloia & Gabriel. Em paralelo à presença na feira, casas de arte de São Paulo aproveitam o período para abrir exposições badaladas pela cidade.', 'Em seguida, uma pausa para a leitura. O segundo grande evento da sequência é a', ', que começa no dia 1º e permanece no Pavilhão do Riocentro até o dia 10 de setembro. Durante esses dez dias, passam pela feira Mauricio de Sousa, Ruy Castro, Ana Maria Machado, Thalita Rebouças, Clara Alves, Lázaro Ramos, os populares Itamar Vieira Júnior, Eliana Alves Cruz e Carla Madeira e as internacionais Cassandra Clare e Julia Quinn.', ', primo paulista do Rock in Rio que promete ser o maior evento musical da capital de São Paulo. No próximo dia 2, o primeiro dia de festival, se apresentam Demi Lovato e Post Malone. No dia seguinte, acontece o primeiro dos dois shows de Bruno Mars, grande atração do evento.', 'As artes plásticas voltam a dominar a cena no dia 6, com o início da 35ª edição da principal mostra de arte do país, a', ', que acontece desde 1951. A edição deste ano, batizada Coreografias do Impossível, traz a diversidade para a pauta com obras como a da artista Stella do Patrocínio, negra, pobre e diagnosticada com esquizofrenia, e a de Arthur Bispo do Rosário, o artista-paciente por excelência, além de muitos outros artistas negros, indígenas e LGBTQIA+.', ', última grande abertura da sequência. Dezenas de galerias nacionais e estrangeiras, além de mais de 100 colecionadores e curadores de arte, se reúnem na feira, que também está entre as maiores do país.', 'Arca - av. Manuel Bandeira, 360, São Paulo. Qua. (30) e qui. (31), das 15h às 19h; sex. (1º) e sáb. (2), das 12h às 19h; dom. (3), das 11h às 18h. R$ 70', 'Riocentro - av. Salvador Allende, 6.555, Rio de Janeiro. Dias 1, 4, 5 e 6 de setembro, das 9h às 21h. Dias 2, 3, 9 e 10, das 10h às 22h. Dias 7 e 8, das 9h às 22h. R$ 39', 'Autódromo de Interlagos - av. sen. Teotônio Vilela, 261, São Paulo. Dias 2, 3, 7, 9 e 10 de setembro, a partir das 14h. R$ 815. Entradas esgotadas para os dias 3, 9 e 10', 'Pavilhão Ciccillo Matarazzo - pq. Ibirapuera - av. Pedro Álvares Cabral, portão 3. Qua. (6), sex. (8) e dom. (10), das 10h às 19h. Qui. e sáb., das 10h às 21h. Entrada gratuita', 'Marina da Glória - av. Infante Dom Henrique, Rio de Janeiro. Qui. (14), sex. (15) e sáb. (16), das 14h às 21h. Dom. (17), das 14h às 20h. R$ 80', 'Você já conhece as vantagens de ser assinante da Folha?Além de ter acesso a reportagens e colunas, você conta com newsletters exclusivas (', 'para receber alertas das principais notícias do dia.A sua assinatura nos ajuda a fazer um jornalismo independente e de qualidade. Obrigado!', 'Mais de 180 reportagens e análises publicadas a cada dia. Um time com mais de 200 colunistas e blogueiros. Um jornalismo profissional que fiscaliza o poder público, veicula notícias proveitosas e inspiradoras, faz contraponto à intolerância das redes sociais e traça uma linha clara entre verdade e mentira. Quanto custa ajudar a produzir esse conteúdo?', 'https://www1.folha.uol.com.br/ilustrada/2023/08/pais-recebe-onda-de-grandes-eventos-culturais-com-the-town-e-sp-arte-veja-lista.shtml', 'Os comentários não representam a opinião do jornal; a responsabilidade é do autor da mensagem.', 'Luísa Sonza anuncia música com americana Demi Lovato, que fará show no The Town', 'Bienal de São Paulo aposta na arte como cura espiritual para as mazelas do mundo', 'Prefeitura avança com obras de requalificação na av. Santo Amaro e muda trânsito', 'Para incentivar produção, agricultura familiar terá mais crédito e juros menores', 'Motorista que atropelou Kayky Brito é desbloqueado em aplicativo de transporte', 'Ludmilla faz show classudo no The Town e prova que merece mais destaque', 'Ludmilla gasta R$ 3 mi em show com inspiração em Beyoncé para o The Town', 'Maroon 5 e Ne-Yo são destaque na quinta do The Town; veja a programação', 'Ministro do STF ainda precisa aceitar e homologar compromisso para ele ter validade', 'Caso das 10 Mil: podcast narra história das mulheres investigadas por aborto em MS', 'Além de enfrentarem processo judicial, pacientes lidaram com implicações sociais e estigma', ""Lula tem 7 de Setembro com chefes de Poderes, Zé Gotinha e 'climão' um dia após reforma"", 'Governo tenta atenuar insatisfação de aliados com trocas ministeriais para ampliar os espaços do centrão', 'Copyright Folha de S.Paulo. Todos os direitos reservados. É proibida a reprodução do conteúdo desta página em qualquer meio de comunicação, eletrônico ou impresso, sem autorização escrita da Folhapress.', 'Empresa Folha da Manhã S.A. - Grupo Folha - Copyright Folha de S.Paulo (1921 - 2023)', 'Folha de S.Paulo é publicado pela Empresa Folha da Manhã S.A. CNPJ: 60.579.703/0001-48', 'Copyright Folha de S.Paulo. Todos os direitos reservados. É proibida a reprodução do conteúdo desta página em qualquer meio de comunicação, eletrônico ou impresso, sem autorização escrita da']"
1,https://www1.folha.uol.com.br/ilustrada/2023/08/bienal-de-sao-paulo-aposta-na-arte-como-cura-espiritual-para-as-mazelas-do-mundo.shtml,"['foi abordada por uma viatura policial nas ruas do bairro de Botafogo, no Rio de Janeiro, e levada à força para um hospital psiquiátrico. Negra, pobre e com um diagnóstico de esquizofrenia, a ex-doméstica passou a viver como interna, situação na qual ficou pelas três décadas seguintes, até morrer, classificada como indigente, dentro do hospício.']","['Bienal de São Paulo propõe cura para mazelas em 35ª edição - 29/08/2023 - Ilustrada - Folha', 'Bienal de São Paulo aposta na arte como cura espiritual para as mazelas do mundo', 'Com 1.100 obras de 121 participantes, maior exposição do país tem predomínio de artistas não brancos e alto teor religioso', ""Detalhe de montagem da instalação 'Parlamento de Fantasmas', de Ibrahim Mahama"", 'foi abordada por uma viatura policial nas ruas do bairro de Botafogo, no Rio de Janeiro, e levada à força para um hospital psiquiátrico. Negra, pobre e com um diagnóstico de esquizofrenia, a ex-doméstica passou a viver como interna, situação na qual ficou pelas três décadas seguintes, até morrer, classificada como indigente, dentro do hospício.', ""'Autorretrato', obra de 1987, guache sobre papel de Ubirajara Ferreira Braga\n             -"", 'Durante seu tempo na Colônia Juliano Moreira, entre injeções, remédios e eletrochoques, Patrocínio participou de atividades nas quais era estimulada a falar. Seus discursos, conhecidos como falatórios, tinham alta densidade poética —tanto que mais tarde foram transformados em um livro de poemas— e podem ser entendidos como dispositivos criados por ela para lidar com a situação de cárcere em que se encontrava.', 'A partir da quarta-feira da semana que vem, o público vai poder ouvir cerca de uma hora e 40 minutos das falas de Patrocínio, transformadas numa obra sonora na', ', a maior exposição de arte do país. Escutar uma mulher considerada louca pelo sistema é uma maneira de entender um conceito central da mostra, o da produção artística como forma de resistência às durezas do mundo.', 'São ""estratégias de resposta, gingados estéticos que uma série de artistas fazem diante dos impossíveis que condicionam seus espaços de origem e pertencimento"", afirma Hélio Menezes, um dos organizadores da mostra, que chega agora à sua 35ª edição.', 'Junto com Patrocínio, estão expostas dezenas de pinturas de outros dois artistas que produziram em manicômios,', 'Se a fala pode curar ou ajudar a lidar com dificuldades, na medida em que põe palavras onde antes não havia, confabular em conjunto com os outros ""talvez seja uma das necessidades mais prementes do nosso tempo"", acrescenta Menezes. Segundo ele, o encontro é outro ponto fundamental da mostra.', 'Não por acaso, a primeira obra que o visitante vê ao entrar no pavilhão do parque Ibirapuera onde o evento acontece é uma pequena arquibancada, proposta por Ibrahim Mahama.', 'Chamado ""Parlamento de Fantasmas"", o trabalho do artista de Gana —uma versão do qual é apresentado agora na Bienal de Arquitetura de Veneza— vai receber conversas, falas, performances, oficinas de dança e até', ', um tipo de dança negra e LGBTQIA+ surgida no bairro do Harlem, em Nova York.', 'A arte do encontro se dará também no mezanino do térreo, onde estará a obra do', ', e no segundo pavimento, num espaço de assembleia conhecido como ""assays"" desenvolvido pelos artistas marroquinos Nadir Bouhmouch e Soumeya Ait Ahmed.', ""Obra 'Pink-Blue', de Kapwani Kiwanga, na exposição 'The Artist Is Present', em Xangai, em 2018; uma versão desse trabalho está na 35ª Bienal de São Paulo\n             -"", 'Encontrar pontos em comum nas obras de arte expostas ajuda o visitante a lidar com a complexidade de uma mostra com 1.100 trabalhos de', 'Dos selecionados, há uma presença expressiva de artistas negros e indígenas, no que se anuncia como a Bienal de São Paulo com o maior número de não brancos até hoje, acentuando uma tendência que já se desenhava nas edições anteriores do evento. É também uma mostra com número expressivo de artistas latinos e africanos.', 'Esta edição tem outra peculiaridade —um grande número de obras que lidam com espiritualidade ou entidades de religiões de matriz africana. Um teor etéreo, do que não pode ser comprovado, perpassa toda a mostra, às vezes de forma explícita nos trabalhos e às vezes presente só no discurso dos artistas. Para a fruição do que está exposto, facilita deixar de lado o pensamento cético.', 'Nessa chave estão alguns trabalhos que ganharam bastante destaque no espaço expositivo, como a floresta de bambus de', 'e Tiganá Santana, uma instalação imersiva de percurso labiríntico na qual o visitante entra e se perde.', 'Heráclito conta que a ideia da obra, encomendada pela mostra, não é reproduzir no pavilhão uma mata do mundo real, mas sim criar ""um espaço de encantados, de seres desencarnados e divindades"". Segundo ele, o trabalho é uma homenagem aos guardiões das florestas, como a Mãe Stella de Oxóssi e o', 'Ayrson Heráclito, à esquerda, e Tiganá Santana, em meio à floresta\n             -', 'Outra obra que funciona num contexto espiritual é a terapia sonora para ajudar na cura do câncer, proposta por Guadalupe Maravilla, um nome quente no circuito, que expôs no ano passado no Museu de Arte Moderna de Nova York, o MoMA. Sobrevivente de um câncer de cólon agressivo, o artista cria grandes esculturas com elementos orgânicos como madeira, penas, ossos e dentes, dentro das quais coloca gongos.', 'Ao ser tocado, o gongo ressoa, gerando vibrações que teriam o poder de restaurar o equilíbrio do corpo e liberar toxinas, o que por sua vez reduziria a dor residual da radiação e de outros procedimentos usados contra o câncer, de acordo com um perfil do artista', 'Essa prática de cura foi resgatada por Maravilla de antigos rituais indígenas da América Central. A obra será ativada em algumas sessões durante a Bienal, com a participação de migrantes enfermos.', 'O público-alvo foi um pedido do próprio artista, dado que Maravilla tem uma história marcada pelo deslocamento. Aos oito anos de idade, ele fugiu da guerra civil em El Salvador, seu país natal, e percorreu o caminho de milhares de quilômetros até a fronteira do México com os Estados Unidos, onde cruzou a divisa na condição de', 'Décadas mais tarde, Maravilla se tornou um nome central da arte contemporânea, num percurso de vida que, como sugere o título da mostra, é uma coreografia do impossível.', 'Ter., qua., sex., e dom., das 10h às 19h; qui. e sáb., das 10h às 21h. De 6 de setembro a 10 de dezembro', 'Você já conhece as vantagens de ser assinante da Folha?Além de ter acesso a reportagens e colunas, você conta com newsletters exclusivas (', 'para receber alertas das principais notícias do dia.A sua assinatura nos ajuda a fazer um jornalismo independente e de qualidade. Obrigado!', 'Mais de 180 reportagens e análises publicadas a cada dia. Um time com mais de 200 colunistas e blogueiros. Um jornalismo profissional que fiscaliza o poder público, veicula notícias proveitosas e inspiradoras, faz contraponto à intolerância das redes sociais e traça uma linha clara entre verdade e mentira. Quanto custa ajudar a produzir esse conteúdo?', 'https://www1.folha.uol.com.br/ilustrada/2023/08/bienal-de-sao-paulo-aposta-na-arte-como-cura-espiritual-para-as-mazelas-do-mundo.shtml', 'Os comentários não representam a opinião do jornal; a responsabilidade é do autor da mensagem.', 'Bienal de São Paulo divulga lista completa de artistas da próxima edição; veja', 'Bienal de São Paulo: Confira os primeiros selecionados para a próxima edição', 'Prefeitura avança com obras de requalificação na av. Santo Amaro e muda trânsito', 'Para incentivar produção, agricultura familiar terá mais crédito e juros menores', 'Motorista que atropelou Kayky Brito é desbloqueado em aplicativo de transporte', 'Ludmilla faz show classudo no The Town e prova que merece mais destaque', 'Ludmilla gasta R$ 3 mi em show com inspiração em Beyoncé para o The Town', 'Maroon 5 e Ne-Yo são destaque na quinta do The Town; veja a programação', 'Ministro do STF ainda precisa aceitar e homologar compromisso para ele ter validade', 'Caso das 10 Mil: podcast narra história das mulheres investigadas por aborto em MS', 'Além de enfrentarem processo judicial, pacientes lidaram com implicações sociais e estigma', ""Lula tem 7 de Setembro com chefes de Poderes, Zé Gotinha e 'climão' um dia após reforma"", 'Governo tenta atenuar insatisfação de aliados com trocas ministeriais para ampliar os espaços do centrão', 'Copyright Folha de S.Paulo. Todos os direitos reservados. É proibida a reprodução do conteúdo desta página em qualquer meio de comunicação, eletrônico ou impresso, sem autorização escrita da Folhapress.', 'Empresa Folha da Manhã S.A. - Grupo Folha - Copyright Folha de S.Paulo (1921 - 2023)', 'Folha de S.Paulo é publicado pela Empresa Folha da Manhã S.A. CNPJ: 60.579.703/0001-48', 'Copyright Folha de S.Paulo. Todos os direitos reservados. É proibida a reprodução do conteúdo desta página em qualquer meio de comunicação, eletrônico ou impresso, sem autorização escrita da']"
