link,metaforico,indice_noticia,paragrafos_resgatados,texto_completo
"https://opiniao.estadao.com.br/noticias/espaco-aberto,aprendiz-de-feiticeiro,70003668660",1,2,"['A esquizofrenia se faz presente no governo: de um lado, caudatário do Centrão, entrega a Secretaria de Governo para inexpressiva deputada gerenciar emendas e cargos; de outro, temeroso da ingerência do Centrão, reforça com amigos a linha repressiva: delegado ligado à bancada da bala no Ministério da Justiça, o disciplinado André Mendonça na AGU e Braga Netto na Defesa. Com tal time e a possível mobilização de polícias militares pelo governo federal, concretiza-se o risco de caminho antidemocrático.']","['Mais poder para quê? Para confrontos e mobilização com ‘seu’ exército? Não haverá!', 'Advogado, professor titular sênior da Faculdade de Direito da USP, membro da Academia Paulista de Letras e ex-ministro da Justiça, Miguel Reale Júnior escreve mensalmente na seção Espaço Aberto', 'Advogado, professor titular sênior da Faculdade de Direito da USP, membro da Academia Paulista de Letras e ex-ministro da Justiça, Miguel Reale Júnior escreve mensalmente na seção Espaço Aberto', 'Mais poder para quê? Para confrontos e mobilização com ‘seu’ exército? Não haverá!', 'Advogado, professor titular sênior da Faculdade de Direito da USP, membro da Academia Paulista de Letras e ex-ministro da Justiça, Miguel Reale Júnior escreve mensalmente na seção Espaço Aberto', 'Mais poder para quê? Para confrontos e mobilização com ‘seu’ exército? Não haverá!', 'Entre os motivos por que alertava para não se votar em Bolsonaro, eu ressaltava, nesta página de outubro de 2018, ser o candidato pessoa que não tivera ao longo da vida relações sociais ou políticas, sendo um', ', sem densidade e compreensão da pluralidade própria do nosso mundo e para quem o Brasil, na sua complexidade, era visto como um quartel.', 'No quartel não há dissidentes ou debate livre entre membros de escalões diferentes, pois, como ensina o', ', 4.ª edição, 2019, as principais características de uma instituição militar são a disciplina e a coesão, entendida a disciplina como o predomínio da ordem e da obediência, sendo esta pronta, espontânea e entusiástica.', 'Bolsonaro, formatado na ordem unida, transformou o Ministério da Saúde num quartel, com ministro general e secretário executivo coronel, imperando o que haviam aprendido na caserna: disciplina, ou seja, um manda e o outro obedece às ordens superiores, com submissão cega às determinações do presidente Bolsonaro. Conclusão: nem no prédio do ministério se usavam máscaras.', 'Enquanto o presidente brincava de “marcha soldado”, milhares de brasileiros morriam. Mas quando chegou a três centenas de milhar, as elites políticas e econômicas resolveram dar um basta à brincadeira.', 'O repertório de encenações do pretenso mito está a se esgotar. Deu, então, uma cambalhota no palco presidencial para reafirmar sua autoridade. Tosco no plano político, sem traquejo na montagem de negociação, que presume ter-se fim preciso a ser alcançado e meios a serem negociados para chegar à meta, Bolsonaro imaginou que, abandonando seus correligionários originais e se unindo ao Centrão, estava garantido no poder para o que desse e viesse.', 'Como o aprendiz de feiticeiro, Bolsonaro desencadeou forças sobre as quais pensou ter controle, mas que o dominam. Como só conhece as regras da ordem unida, e não a arte da mudança de rumos e da aceitação de uma pluralidade de soluções, imaginou que teria à frente da Câmara e no Senado, em razão de seu apoio, dois outros Pazuellos.', 'Bolsonaro é presidente, mas sente que não mais governa, só administra crises e corre atrás do prejuízo. Diante do desastre sanitário gigantesco, o Centrão resolveu intervir no governo. Forçado pelos dirigentes das Casas do Congresso, Bolsonaro demitiu o ministro da Saúde, mas não seguiu a orientação de nomear médica de São Paulo, para desgosto em especial de Arthur Lira, que chegou a dizer serem os remédios do Parlamento amargos, podendo mesmo ser fatais.', 'Bolsonaro, em vista dessa pressão decorrente do número de mortos e do desespero da situação hospitalar, resolveu convocar os chefes dos Poderes para possível pacto, deixando, contudo, de convidar governadores, prefeitos e secretários da Saúde, contra os quais se voltou em posterior reunião do comitê, para culpá-los pelo desemprego decorrente das sabidamente necessárias medidas restritivas. O presidente do Senado, ao contrário, reuniu-se com governadores e deles recebeu várias sugestões.', 'Há evidente parlamentarismo branco. Os presidentes da Câmara e do Senado impuseram a saída do ministro das Relações Exteriores, Ernesto Araújo, cuja gestão fora desastrosa para o Itamaraty. Araújo pediu demissão, apesar de já demitido por Rodrigo Pacheco e Arthur Lira.', 'Tendo-se feito de surdos-mudos em meio à tormenta, na resistência, própria das vítimas de estelionato, a se reconhecerem enganadas, como o foram, por Bolsonaro, os agentes econômicos (Fiesp e Febraban) finalmente resolveram se juntar aos presidentes da Câmara e do Senado e tomar posição em face do presidente. Formou-se, então, um conjunto consistente de pressão sobre o governo.', 'Em reação, o presidente demitiu o Ministro da Defesa, que preservara as Forças Armadas como instituição de Estado, merecendo por isso o apoio dos comandantes das três Armas. No campo militar e nos ministérios da área jurídica, Bolsonaro tenta criar nichos de obediência, com ministros próximos à família, serviçais como Pazuello, a permitir-lhe até mesmo o devaneio do estado de sítio e de se afirmar como presidente.', 'A esquizofrenia se faz presente no governo: de um lado, caudatário do Centrão, entrega a Secretaria de Governo para inexpressiva deputada gerenciar emendas e cargos; de outro, temeroso da ingerência do Centrão, reforça com amigos a linha repressiva: delegado ligado à bancada da bala no Ministério da Justiça, o disciplinado André Mendonça na AGU e Braga Netto na Defesa. Com tal time e a possível mobilização de polícias militares pelo governo federal, concretiza-se o risco de caminho antidemocrático.', 'Pouca preocupação há em dotar o governo de capacidade gerencial ante a pandemia e a crise econômica que se avizinha: o que se quer é poder. E assim o aprendiz de feiticeiro tenta novos contorcionismos visando a sobrenadar no mar dos seus desatinos. Mas mais poder para quê? Para confrontos e mobilização nacional com o “seu” exército? Não haverá!', 'ADVOGADO, PROFESSOR TITULAR SÊNIOR DA FACULDADE DE DIREITO DA USP, MEMBRO DA ACADEMIA PAULISTA DE LETRAS, FOI MINISTRO DA JUSTIÇA']"
"https://cultura.estadao.com.br/noticias/literatura,em-novo-livro-simon-schwartzman-articula-memorias-e-busca-novos-caminhos-para-o-brasil,70003644612",1,3,"['""Durante meus dois anos\xa0em Berkeley, não\xa0conheci um\xa0americano sequer que pertencesse ao Partido Republicano.\xa0Mas Ronald Reagan foi eleito governador da Califórnia em 1967,\xa0e é dele a assinatura que tenho em meu diploma de doutorado,\xa0como presidente do Conselho de Regentes da Universidade. Em\xa01968, acompanhei pela televisão, horrorizado, as notícias sobre os\xa0assassinatos de Martin Luther King e Robert Kennedy (...). No fim de 1968, estava tudo pronto para voltarmos ao Brasil,\xa0onde eu deveria me integrar ao Departamento de Ciência Política\xa0da UFMG e redigir minha tese. Foi quando o governo brasileiro\xa0decretou o AI-5, interrompendo o que parecia ser um processo\xa0de melhora do clima político no Brasil. A repressão recrudesceu\xa0e fiquei sem saber o que fazer. Apter sugeriu que eu permanecesse por mais tempo em Berkeley, mas Carmen e eu acabamos\xa0tomando uma decisão esquizofrênica: despachamos o contêiner\xa0com nossa mudança para Buenos Aires e tomamos o avião para\xa0o Brasil, a caminho de Belo Horizonte, com Michel, nosso filho\xa0recém-nascido, no colo.”']","['Em novo livro, Simon Schwartzman articula memórias e busca novos caminhos para o Brasil - Estadão', 'Em novo livro, Simon Schwartzman articula memórias e busca novos caminhos para o Brasil', ""'Há um ataque contra a educação, a cultura, a democracia, e isso dificulta a discussão nessas áreas', afirma o autor em entrevista ao 'Estadão'"", 'até a Polônia. A remetente, Vera Ejlenberg, realizava pesquisas sobre o rabino Chaim Radzyner, e buscava informações. Schwartzman reconheceu o nome do bisavô de sua mãe. E, em meados de 2019, partiu para a Europa, onde participou de um encontro por conta dos 75 anos da destruição do gueto da cidade de Lodz.', 'Em livro, Luiz Schwarcz relata com franqueza sua luta contra a depressão', '“Eu tinha poucas informações sobre a história da família de minha mãe. Ela dizia que todos haviam morrido durante a guerra. A viagem me colocou em contato com outros lados dessa história. E com um lado que não é o meu único, mas que com certeza é importante na minha trajetória”, conta o sociólogo e cientista político. Não apenas isso. “Estar ali reviveu a presença da guerra, do Holocausto, da resistência. Não era nada que eu não soubesse, mas foi uma experiência forte, de impacto muito grande.” E, de volta ao Brasil, Schwartzman começou a trabalhar em um livro de memórias,', ', que será lançado na quarta-feira, dia 17, com uma live que vai reunir, além do autor, Pedro Malan e Helena Bomeny, com mediação de Roberto Feith, editor do selo História Real, da Editora Intrínseca. É com o relato da viagem a Lodz que Schwartzman, colunista do', ', abre sua narrativa. Mas a lembrança pessoal convive no livro com a preocupação em discutir temas da história brasileira. “O objetivo foi ir além das memórias pessoais, ou seja, utilizar a trajetória pessoal para discutir questões atuais”, explica o autor, que as define no início da obra: política e autoritarismo; modernidade e democracia; conhecimento, ciência e tecnologia; ciência e ideologia; educação e diversidade; sociedade e economia. São temas presentes desde cedo em sua trajetória profissional. Formado pela Universidade Federal de Minas Gerais, Schwartzman fez seu mestrado na Faculdade Latino-Americana de Ciências Sociais, no Chile. E, na Universidade da Califórnia, em Berkeley, o doutorado. Deu aulas em instituições como a USP, o Woodrow Wilson International Center, em Washington, e a Universidade de Columbia, entre muitas outras. Ele se envolveu em diversos episódios da história brasileira. Foi preso e interrogado durante 40 dias em 1964 pela ditadura militar, que não sabia bem que acusações impor contra ele – e resolveu exilar-se na Dinamarca, seguindo depois para a Argentina. A carreira pedagógica e voltada à pesquisa, a certa altura, o levou também a ocupar posições como a de presidente do Instituto Brasileiro de Geografia e Estatística (IBGE) e do Instituto de Estudos do Trabalho e Sociedade. E, ao longo de todo esse tempo, produziu obras fundamentais para a compreensão do País, a começar por Bases do Autoritarismo Brasileiro, livro que nasce de sua tese de doutorado. Nele, como o próprio Schwartzman explica, buscava mostrar como “o sistema político não era mero instrumento dos interesses dos ricos e poderosos, tendo uma dinâmica própria que precisava ser mais bem entendida”. “A espinha dorsal de meu livro era a de que no Brasil coexistiam duas formas de dominação: uma de tipo patrimonial, herdada da Coroa portuguesa e que nunca dependeu de poderes feudais para existir, consolidando-se na capital do País, o Rio de Janeiro; e outra, de tipo mais contratual, originada da parte mais dinâmica e autônoma da economia, baseada sobretudo em São Paulo. Daí o fato de uma das teses mais controvertidas e questionadas do livro ser a de que, no Brasil, o centro do poder econômico sempre teve uma posição relativamente subordinada, e por isso conflituosa, com o centro político.” Não é pouco mérito o fato de que, em', ', a memória dos trabalhos acadêmicos e pesquisas realizadas e a lembrança de episódios pessoais sejam narradas com a mesma clareza e sabor. “Eu aprendi com o tempo que, se você não entende algo ao ler, a culpa é de quem escreveu. Há temas complexos, sem dúvida, e textos de caráter mais técnico, mas se você não tem clareza normalmente é porque as ideias não estão claras”, diz. E o livro, nessa combinação de narrativas, torna-se não apenas o registro de uma memória individual, mas da tentativa de criação de uma ideia de país.', 'A live de lançamento do livro terá como tema “Populismo vs. Ciência: o desafio da construção de políticas públicas eficazes”. É um assunto do qual ela trata bastante ao longo de Falso Mineiro. Por exemplo, ao definir a importância da separação entre atividade científica e atividade política. “Na faculdade, em Belo Horizonte, nossa preocupação era como sair do atraso, buscar caminhos distintos foi uma motivação de toda a minha geração que, claro, seguiu orientações diferentes. No ambiente estudantil, conhecimento e militância eram a mesma coisa. Mas, com o tempo, aprendi que a política condiciona e limita a capacidade de atuar de forma independente.”\xa0 Para ele, não se trata de falta de engajamento, mas de outra definição para o termo. “Eu me engajei muito, briguei pelos temas que acreditava serem importantes, eu me envolvi com eles. Mas sempre mantendo uma independência, sem servir a conveniências políticas.” Reflexões como essa se tornam importantes em especial no momento em que vivemos. “É uma situação anômala, de um governo anti-intelectual. Há um ataque contra a educação, a cultura, a democracia, e isso dificulta a discussão nessas áreas. Porque elas precisam ser discutidas, são problemáticas. Não concordo com a ideia de que antes tudo funcionava bem. Mas a discussão sempre girou em torno de como melhorar esses aspectos e não em torno do próprio questionamento de sua existência.” Para Schwartzman, há uma nova geração interessante na ciência brasileira. Mas é preciso pensar em novos caminhos, em especial no que diz respeito à “fuga de cérebros”. “Houve um período de expansão na ciência acadêmica. As universidades públicas cresceram e, com isso, muitas posições e cargos foram criados. Um jovem brasileiro, após ir para o exterior, com bolsas como Capes e CNPq, voltava e encontrava posições. Mas a ciência acabou ficando muito fechada no mundo acadêmico e, depois de o sistema crescer, já não consegue absorver todos os profissionais. A questão hoje é pensar sobre como fazer ciência de maior qualidade e mais efetiva, menos voltada para si mesma. E como vincular a ela questões mais práticas, algo que envolve tanto a iniciativa privada quanto o governo”, explica.', '""Durante meus dois anos\xa0em Berkeley, não\xa0conheci um\xa0americano sequer que pertencesse ao Partido Republicano.\xa0Mas Ronald Reagan foi eleito governador da Califórnia em 1967,\xa0e é dele a assinatura que tenho em meu diploma de doutorado,\xa0como presidente do Conselho de Regentes da Universidade. Em\xa01968, acompanhei pela televisão, horrorizado, as notícias sobre os\xa0assassinatos de Martin Luther King e Robert Kennedy (...). No fim de 1968, estava tudo pronto para voltarmos ao Brasil,\xa0onde eu deveria me integrar ao Departamento de Ciência Política\xa0da UFMG e redigir minha tese. Foi quando o governo brasileiro\xa0decretou o AI-5, interrompendo o que parecia ser um processo\xa0de melhora do clima político no Brasil. A repressão recrudesceu\xa0e fiquei sem saber o que fazer. Apter sugeriu que eu permanecesse por mais tempo em Berkeley, mas Carmen e eu acabamos\xa0tomando uma decisão esquizofrênica: despachamos o contêiner\xa0com nossa mudança para Buenos Aires e tomamos o avião para\xa0o Brasil, a caminho de Belo Horizonte, com Michel, nosso filho\xa0recém-nascido, no colo.”']"
