link,metaforico,indice_noticia,paragrafos_resgatados,texto_completo
https://brasil.estadao.com.br/blogs/macaco-eletrico/a-esquizofrenia-do-posicionamento/,1,21,"['Vivemos, portanto, uma ""esquizofrenia do posicionamento"": se correr, o bicho pega; se ficar, o bicho come!', 'Por isso, a melhor maneira de vencer a esquizofrenia do posicionamento é não embarcar nessa loucura.']","['Há alguns dias, me perguntaram se se posicionar politicamente nas redes sociais nos atrapalharia profissionalmente. Essa é uma pergunta simples para uma resposta complexa.', 'Graças ao momento de grande intolerância e polarização em que vivemos, não há mais zona segura. Qualquer posicionamento, por mais bem intencionado, equilibrado e embasado que seja, torna-se potencialmente explosivo graças àqueles que pensam de maneira diferente. E sempre haverá muitas pessoas que pensam diferentemente de nós.', 'Poderíamos considerar então que o caminho para não termos prejuízos por nossa exposição seria não se posicionar. Mas isso também não é uma opção aceitável, pois as pessoas esperam que nos posicionemos. Não fazer isso enfraquece a nossa imagem nas redes sociais, cujos algoritmos de relevância premiam aqueles que estão sempre se expondo.', 'Resta a hipótese de simplesmente não aparecer nas redes sociais. Mas, em um mundo hiperconectado, ficar de fora dessas plataformas implica em quase desaparecer para nosso público, abrindo caminho para os concorrentes.', 'Vivemos, portanto, uma ""esquizofrenia do posicionamento"": se correr, o bicho pega; se ficar, o bicho come!', 'A verdade é que não existe uma fórmula mágica para o posicionamento nessa realidade. Mas como sempre aparecemos, de um jeito ou de outro, essa é uma atividade de autoconhecimento, antes de mais nada. Afinal, se não soubermos nossos pontos fortes, como poderemos transmitir isso ao outro?', 'Precisamos também ter uma atitude de autopreservação. Considerando que nunca se sabe o que movimenta o ""humor"" dos algoritmos de relevância (e cada rede tem o seu, às vezes um tanto ""ranzinzas""), não devemos nos tornar escravos dele. Isso contraria o que a maioria dos ""gurus de redes sociais"" prega, com suas ""fórmulas mágicas"" para ganhar seguidores e visualizações (que, no final, de pouco ou nada servem). É dessa forma que protegemos nossa saúde mental, que já vinha abalada por essa busca frenética de exposição digital e foi castigada pelos efeitos da pandemia de Covid-19.', 'É também um exercício de correr riscos calculados. Qualquer forma de exibição implica em alguns apontando dedos e dizendo que está ruim, errado ou feio. E isso é inevitável! Mas podemos mitigar esse risco ao conhecer bem nosso público, como ele se comunica, o que procura no que podemos lhe oferecer. Se nos posicionarmos atendendo isso, por mais que alguns ""torçam o nariz"", aumentamos nossa chance de deixar uma boa imagem àqueles que realmente importam para nós.', 'Por isso, acho interessante o que muitos profissionais de saúde vêm fazendo no TikTok. Eles dão dicas em suas áreas dentro das características da rede, incluindo, em alguns casos, as infames ""dancinhas"". Já ouvi várias pessoas afirmando que aquilo denigre as imagens desses profissionais. Não vejo assim: aquela é a linguagem da plataforma e seus usuários estão acostumados a isso. Ao fazer assim, esses profissionais estão prestando um serviço que talvez não chegaria àquele público se se restringissem a ""formatos convencionais"" de posicionamento.', 'Devemos entender que as pessoas mudaram, e esse é um processo cuja velocidade cresce exponencialmente.', 'A digitalização de nossas vidas começou nos anos 1980, ganhou força com a Internet comercial na década de 1990 e explodiu com as redes sociais combinadas ao smartphones nos últimos 15 anos.', 'Há ainda um fator inesperado e extremamente dolorido, mas que acelerou ainda mais tais inovações: a pandemia. Mudanças nas empresas e em nossas vidas, que demorariam anos para acontecer, ocorreram em questão de poucos meses no ano passado. E qualquer que seja o caminho que encontremos ao sair desse cenário de privações, ele carregará para sempre elementos de um novo jeito de viver.', 'Uma das coisas mais emblemáticas nisso é que hoje fazemos ainda mais coisas online do que fazíamos em 2019. Algumas atividades então bem pouco desenvolvidas, como o', 'e o ensino à distância, cresceram e assumiram uma dimensão em nosso cotidiano que não pode mais ser ignorada.', 'A maneira como compramos hoje também ficou muito mais online. O relatório Webshoppers, da consultoria Ebit | Nielsen, demonstra uma explosão nisso em 2020, com um crescimento de 41% na receita do e-commerce brasileiro frente ao ano anterior, chegando a R$ 87,4 bilhões. No total de consumidores, o e-commerce brasileiro atingiu 79,7 milhões de pessoas, 29% a mais que em 2019, o que representa 38% da população brasileira total. Além disso, 2020 foi o ano em que 13,2 milhões de brasileiros compraram algo online pela primeira vez em suas vidas.', 'Esse novo comportamento das pessoas frente ao varejo pode ser extrapolado, com segurança, para a maioria dos serviços. Outra coisa que cresceu enormemente no ano passado (até mesmo por conta da pandemia) foram os atendimentos médicos e psicológicos pelos computadores ou celulares. Tanto que a telemedicina acabou sendo regulamentada no Brasil em março. Os atendimentos psicológicos já tinham sido autorizados pelo Conselho Federal de Psicologia em 2018.', 'Obviamente não precisamos fazer dancinhas no TikTok para termos um bom posicionamento no meio digital. Essas ações ""performáticas"" podem gerar muita visibilidade, mas a qualidade do contato é muito mais importante que a quantidade.', 'Ser autêntico é fundamental por vários motivos. Em primeiro lugar, isso torna todo o processo mais leve para nós. Quando criamos nas redes uma imagem que não condiz com quem somos, um ""personagem digital"", temos que estar sempre atentos para não trair sua personalidade. Quanto mais diferente de nós, mais de nossa energia essa personalidade alternativa consumirá.', 'Infelizmente, esse recurso é muito usado. Além desse consumo de energia, ele embute um outro potencial problema, que pode ser devastador para a imagem de qualquer um. Quando se cria esse ""avatar"" que não condiz com nossos atos e valores, corre-se o risco de ser desmascarado.', 'Foi o que aconteceu com a cantora Karol Conká, na edição desse ano do ""Big Brother Brasil"". Ela foi eliminada do programa com uma votação recorde de 97,17%, por ter demonstrado arrogância, preconceito e agressividade. Seus fãs viram ali uma pessoa que contrastava com a personagem construída na mídia e nas redes sociais. Como resultado, quando deixou a casa, tinha perdido algo como 40% de seus seguidores e contratos que chegavam a R$ 5 milhões.', 'Para evitar o temido ""cancelamento"", neologismo que descreve o que aconteceu com Karol, seja, portanto, autêntico. Além disso, suas opiniões devem ser sempre embasadas. E isso nos leva a um outro fenômeno recente, que é o abuso do direito de ""liberdade de expressão"".', 'As redes foram tomadas por pessoas que, invocando tal liberdade, acham que podem dizer o que bem entenderem, além de ofender deliberadamente quem pensa de maneira diferente em qualquer assunto.', 'Em um primeiro momento, isso pode gerar muita visibilidade e até atrair fãs, mas essa não é uma tática sustentável. Isso não é liberdade de expressão (que tem limites), e sim agir como um ogro digital. Comportamentos destrutivos e agressivos devem ser substituídos por atitudes construtivas e agregadoras, se o objetivo for elaborar um posicionamento de qualidade e duradouro.', 'Aparecer nas redes sociais não pode ser algo que cause dor ou exija muita energia. Se isso estiver acontecendo, algo precisa ser repensado.', 'Concentre-se no campo das ideias positivas, compartilhe um pouco do que sabe. E entenda que, ainda assim, não agradará todo mundo. Mas basta agradar aqueles com quem queremos nos relacionar. Se fizer tudo corretamente e alguém não gostar, provavelmente essa pessoa não faz parte do seu público.', 'Por isso, a melhor maneira de vencer a esquizofrenia do posicionamento é não embarcar nessa loucura.']"
https://politica.estadao.com.br/blogs/fausto-macedo/a-grande-chance-reforma-eleitoral/,1,22,"['Começando pela propaganda, a verdade é que o Brasil tem o sistema mais regulado de campanha eleitoral do mundo. É algo esquizofrênico. No início da onda de restrições à propaganda, lá em 2006, estava a ideia de controlar gastos. Depois nós evoluímos com o teto de gastos, inclusive item a item, o que dispensaria a super regulamentação da propaganda. Mas não dispensamos. Definir o tamanho de adesivo para bicicleta, para citar um exemplo exótico da Lei Eleitoral, é uma vergonha. Temos que higienizar e desidratar a disciplina da propaganda eleitoral, dando mais espaço para os candidatos. Há bons estudos mostrando déficit de informação do eleitor em razão da hiper-regulamentação. Na essência, basta o teto de gastos.']","['Hoje temos uma balbúrdia legislativa na área eleitoral. O que é sistematizado, o Código Eleitoral de 1965, está muito defasado. E o que tem de mais novo, toda legislação pós Constituição de 1988, está distribuído em previsões legais assistemáticas. Esse desarranjo tem efeitos colaterais graves, com inevitável redução do índice de legitimidade da nossa democracia.', 'Não era e não é mais possível seguir promovendo apenas reformas circunstanciais, sem nenhum compromisso com um concerto sistêmico. É de democracia que estamos falando, afinal.', 'O arranjo de tudo isso começou muito bem com a Sistematização das Normais Eleitorais pelo TSE. Coordenado pelo Ministro Fachin, um time muito qualificado fez um diagnóstico preciso. No entanto, o TSE não pode avançar para além das suas Resoluções. A necessidade maior do arranjo está na legislação. Por isso a importância decisiva do Grupo de Trabalho criado pelo Presidente Arthur Lira e sob Relatoria de Margarete Coelho, uma deputada de sólida formação acadêmica na área eleitoral. Ligar o trabalho do TSE com o ""Grupo da Margarete"" é a chave para avançar.', 'A ideia central é separar o que há de melhor, descartar o que não serve e criar regras novas, reunindo tudo em um novo Código Eleitoral moderno, de fácil compreensão e sem gargalos sistêmicos. Margarete conseguiu envolver todas as entidades que atuam na área e mais de cem professores e pesquisadores da Academia Brasileira de Direito Eleitoral - a ABRADEP. É uma chance de ouro para darmos um enorme salto de qualidade na segurança jurídica das regras eleitorais brasileiras.', 'Diante da atual balbúrdia, é importante reconhecer que o TSE avançou excessivamente no seu poder regulamentar. Paradoxalmente, há certo consenso em reconhecer que sem as Resoluções do TSE não é possível realizar eleições no Brasil. O TSE não está confortável em ter que editar múltiplas resoluções analíticas a cada eleição, invadindo áreas de reserva legal, por expressa disposição do art. 22, inciso I, da Constituição Federal. A ideia é promover uma importação crítica de muitos pontos das Resoluções para o novo Código Eleitoral. Com isso, desidratamos o excessivo poder regulamentar do TSE e entregamos à democracia brasileira mais segurança jurídica, com a estabilização das regras.', 'Além do concerto sistêmico, será possível avançar em temas importantes.', 'Sobre as mudanças, é importante compreender que há uma distinção, nem sempre muito nítida, entre o que é reforma política e o que é aprimoramento da legislação eleitoral. A reforma política quase sempre pressupõe a necessidade de emenda constitucional, com quórum alto e enorme controvérsia política. É muito difícil fazer reforma política; desde Clístenes, na Grécia, como nos conta o inglês Roger Osborne. Mudanças no sistema eleitoral e partidário não são neutras e, por isso, mobilizam os políticos que temem não sobreviver nos modelos novos. É natural. Mesmo sem uma reforma política é possível avançar em temas sensíveis que estão a demandar aprimoramento. Menciono aqui, como exemplo, o sistema de inelegibilidades, o financiamento de campanha e a propaganda eleitoral, além de toda a área do contencioso eleitoral.', 'Começando pela propaganda, a verdade é que o Brasil tem o sistema mais regulado de campanha eleitoral do mundo. É algo esquizofrênico. No início da onda de restrições à propaganda, lá em 2006, estava a ideia de controlar gastos. Depois nós evoluímos com o teto de gastos, inclusive item a item, o que dispensaria a super regulamentação da propaganda. Mas não dispensamos. Definir o tamanho de adesivo para bicicleta, para citar um exemplo exótico da Lei Eleitoral, é uma vergonha. Temos que higienizar e desidratar a disciplina da propaganda eleitoral, dando mais espaço para os candidatos. Há bons estudos mostrando déficit de informação do eleitor em razão da hiper-regulamentação. Na essência, basta o teto de gastos.', 'No tema do financiamento, a decisão do STF de barrar indiscriminadamente as doações de pessoas jurídicas, em clássico exemplo de indesejado ativismo, merece ""revisão"". A minirreforma eleitoral de 2015, com a proibição do financiamento de empresas, foi embalada pela decisão do STF. Temos que achar um meio termo aí, conciliando financiamento pelas empresas, com limites rígidos de tetos nominais. O atual sistema põe toda energia dos partidos na eleição de deputados federais, responsáveis por definir o pedaço do rateio do financiamento público (partidário e de campanha). Isso está gerando uma enorme distorção. Muitos partidos não querem mais disputar os cargos majoritários. O ponto é sensível, mas dá para avançar.', 'Uma década depois, é fundamental revisitar a Lei da Ficha Limpa. A ideia não é restabelecer o desenho anterior das inelegibilidades - que era ruim -, mas aprimorar o atual, concebido às pressas e para aplacar uma fúria moralista um tanto quanto irracional. Não há sentido no prazo único de oito anos para todas as inelegibilidades, para citar um exemplo óbvio. Espero que o Congresso aprimore, mas a matéria é bem controvertida, reconheço.', 'O importante é organizar tudo e, além disso, fazer reformas incrementais. A Deputada Margarete vai saber calibrar a dimensão do avanço que cabe no ambiente político do Congresso. A democracia brasileira pode dar um belo salto de qualidade. A chance é única.', '*Luiz Fernando Casagrande Pereira tem mestrado e doutorado pela UFPR. No mês de março, foi eleito coordenador-geral da Academia Brasileira de Direito Eleitoral e Político, a ABRADEP. Recentemente, foi escolhido pelo presidente da Câmara, Arthur Lira, para integrar um grupo de quatro professores que darão consultoria na reforma da legislação eleitoral']"
"https://opiniao.estadao.com.br/noticias/espaco-aberto,aprendiz-de-feiticeiro,70003668660",1,23,"['A esquizofrenia se faz presente no governo: de um lado, caudatário do Centrão, entrega a Secretaria de Governo para inexpressiva deputada gerenciar emendas e cargos; de outro, temeroso da ingerência do Centrão, reforça com amigos a linha repressiva: delegado ligado à bancada da bala no Ministério da Justiça, o disciplinado André Mendonça na AGU e Braga Netto na Defesa. Com tal time e a possível mobilização de polícias militares pelo governo federal, concretiza-se o risco de caminho antidemocrático.']","['Mais poder para quê? Para confrontos e mobilização com ‘seu’ exército? Não haverá!', 'Advogado, professor titular sênior da Faculdade de Direito da USP, membro da Academia Paulista de Letras e ex-ministro da Justiça, Miguel Reale Júnior escreve mensalmente na seção Espaço Aberto', 'Advogado, professor titular sênior da Faculdade de Direito da USP, membro da Academia Paulista de Letras e ex-ministro da Justiça, Miguel Reale Júnior escreve mensalmente na seção Espaço Aberto', 'Mais poder para quê? Para confrontos e mobilização com ‘seu’ exército? Não haverá!', 'Advogado, professor titular sênior da Faculdade de Direito da USP, membro da Academia Paulista de Letras e ex-ministro da Justiça, Miguel Reale Júnior escreve mensalmente na seção Espaço Aberto', 'Mais poder para quê? Para confrontos e mobilização com ‘seu’ exército? Não haverá!', 'Entre os motivos por que alertava para não se votar em Bolsonaro, eu ressaltava, nesta página de outubro de 2018, ser o candidato pessoa que não tivera ao longo da vida relações sociais ou políticas, sendo um', ', sem densidade e compreensão da pluralidade própria do nosso mundo e para quem o Brasil, na sua complexidade, era visto como um quartel.', 'No quartel não há dissidentes ou debate livre entre membros de escalões diferentes, pois, como ensina o', ', 4.ª edição, 2019, as principais características de uma instituição militar são a disciplina e a coesão, entendida a disciplina como o predomínio da ordem e da obediência, sendo esta pronta, espontânea e entusiástica.', 'Bolsonaro, formatado na ordem unida, transformou o Ministério da Saúde num quartel, com ministro general e secretário executivo coronel, imperando o que haviam aprendido na caserna: disciplina, ou seja, um manda e o outro obedece às ordens superiores, com submissão cega às determinações do presidente Bolsonaro. Conclusão: nem no prédio do ministério se usavam máscaras.', 'Enquanto o presidente brincava de “marcha soldado”, milhares de brasileiros morriam. Mas quando chegou a três centenas de milhar, as elites políticas e econômicas resolveram dar um basta à brincadeira.', 'O repertório de encenações do pretenso mito está a se esgotar. Deu, então, uma cambalhota no palco presidencial para reafirmar sua autoridade. Tosco no plano político, sem traquejo na montagem de negociação, que presume ter-se fim preciso a ser alcançado e meios a serem negociados para chegar à meta, Bolsonaro imaginou que, abandonando seus correligionários originais e se unindo ao Centrão, estava garantido no poder para o que desse e viesse.', 'Como o aprendiz de feiticeiro, Bolsonaro desencadeou forças sobre as quais pensou ter controle, mas que o dominam. Como só conhece as regras da ordem unida, e não a arte da mudança de rumos e da aceitação de uma pluralidade de soluções, imaginou que teria à frente da Câmara e no Senado, em razão de seu apoio, dois outros Pazuellos.', 'Bolsonaro é presidente, mas sente que não mais governa, só administra crises e corre atrás do prejuízo. Diante do desastre sanitário gigantesco, o Centrão resolveu intervir no governo. Forçado pelos dirigentes das Casas do Congresso, Bolsonaro demitiu o ministro da Saúde, mas não seguiu a orientação de nomear médica de São Paulo, para desgosto em especial de Arthur Lira, que chegou a dizer serem os remédios do Parlamento amargos, podendo mesmo ser fatais.', 'Bolsonaro, em vista dessa pressão decorrente do número de mortos e do desespero da situação hospitalar, resolveu convocar os chefes dos Poderes para possível pacto, deixando, contudo, de convidar governadores, prefeitos e secretários da Saúde, contra os quais se voltou em posterior reunião do comitê, para culpá-los pelo desemprego decorrente das sabidamente necessárias medidas restritivas. O presidente do Senado, ao contrário, reuniu-se com governadores e deles recebeu várias sugestões.', 'Há evidente parlamentarismo branco. Os presidentes da Câmara e do Senado impuseram a saída do ministro das Relações Exteriores, Ernesto Araújo, cuja gestão fora desastrosa para o Itamaraty. Araújo pediu demissão, apesar de já demitido por Rodrigo Pacheco e Arthur Lira.', 'Tendo-se feito de surdos-mudos em meio à tormenta, na resistência, própria das vítimas de estelionato, a se reconhecerem enganadas, como o foram, por Bolsonaro, os agentes econômicos (Fiesp e Febraban) finalmente resolveram se juntar aos presidentes da Câmara e do Senado e tomar posição em face do presidente. Formou-se, então, um conjunto consistente de pressão sobre o governo.', 'Em reação, o presidente demitiu o Ministro da Defesa, que preservara as Forças Armadas como instituição de Estado, merecendo por isso o apoio dos comandantes das três Armas. No campo militar e nos ministérios da área jurídica, Bolsonaro tenta criar nichos de obediência, com ministros próximos à família, serviçais como Pazuello, a permitir-lhe até mesmo o devaneio do estado de sítio e de se afirmar como presidente.', 'A esquizofrenia se faz presente no governo: de um lado, caudatário do Centrão, entrega a Secretaria de Governo para inexpressiva deputada gerenciar emendas e cargos; de outro, temeroso da ingerência do Centrão, reforça com amigos a linha repressiva: delegado ligado à bancada da bala no Ministério da Justiça, o disciplinado André Mendonça na AGU e Braga Netto na Defesa. Com tal time e a possível mobilização de polícias militares pelo governo federal, concretiza-se o risco de caminho antidemocrático.', 'Pouca preocupação há em dotar o governo de capacidade gerencial ante a pandemia e a crise econômica que se avizinha: o que se quer é poder. E assim o aprendiz de feiticeiro tenta novos contorcionismos visando a sobrenadar no mar dos seus desatinos. Mas mais poder para quê? Para confrontos e mobilização nacional com o “seu” exército? Não haverá!', 'ADVOGADO, PROFESSOR TITULAR SÊNIOR DA FACULDADE DE DIREITO DA USP, MEMBRO DA ACADEMIA PAULISTA DE LETRAS, FOI MINISTRO DA JUSTIÇA']"
https://politica.estadao.com.br/blogs/fausto-macedo/o-terceiro-setor-e-a-necessidade-de-marcas-com-proposito/,1,24,['Muitos departamentos de marketing lançavam uma infinidade de produtos de forma quase esquizofrênica e investiam verbas em influenciadores simplesmente sem qualquer histórico ou análise de conteúdo mais profundo.'],"['A pandemia potencializou de forma avassaladora as desigualdades sociais e ""jogou na nossa cara"" uma mudança comportamental que as marcas mais antenadas já vinham se dando conta', 'Muitos departamentos de marketing lançavam uma infinidade de produtos de forma quase esquizofrênica e investiam verbas em influenciadores simplesmente sem qualquer histórico ou análise de conteúdo mais profundo.', 'Profissionais ávidos por likes e métricas vendidas como ""fumaça ensacada"" já não colam mais e fazem com que alguns profissionais sejam obrigados a rever seus conceitos preguiçosos e obsoletos para entrar no mundo real do ""novo normal"".', 'Com o confinamento, a crise econômica e a capacidade crítica das novas gerações, lançar um produto que visa simplesmente o lucro pode ser uma verdadeira catástrofe. O consumidor quer adquirir uma história carregada de propósito, sustentabilidade e que faça uma cadeia ser realmente produtiva.', 'O novo ""comprador"" quer ter orgulho do produto que está em sua casa ao saber que ele, de alguma forma, muda a vida de uma comunidade, empodera uma mulher, que através daquela colaboração consegue não virar estatística de feminicídio em nosso país.', 'É hora de os grandes empresários de todos os setores olharem para dentro de seus departamentos, antes que sejam engolidos por uma concorrência que já entendeu quem é e o vai se consumir no pós pandemia.', 'Cada dia fica mais claro a necessidade de profissionais que entendam e enxerguem a comunicação como algo amplo com uma visão 360 graus, onde tudo é perfeitamente alinhado, pensado e construído no seu devido tempo e, consequentemente, a construção de cases que não virem poeira como ""likes"" comprados por redes fantasiosas.', '*Patricia Alves é diretora da Patwork, faz parte do Comitê de Comunicação da LoveTogether Brasil, é conselheira da ONG Aliança Solidária e colunista na revista Mensch. Jornalista graduada pela FMU de São Paulo, pós-graduada em Comunicação Coorporativa pela Fundação Casper Líbero. Repórter de TV no programa Empresários de Sucesso da Band News, Band Internacional e canal Terra Viva']"
