link,metaforico,indice_noticia,paragrafos_resgatados,texto_completo
"https://saude.estadao.com.br/noticias/geral,pesquisas-tem-associado-idade-do-homem-a-problemas-na-gestacao-e-no-bebe,70002912610",0,49,"['Artigo publicado em março por pesquisadoras da Universidade Rutgers, em Nova Jersey (EUA), reuniu informações deste e de outros 22 estudos. Além de problemas ao nascer, pesquisas compiladas haviam associado a paternidade tardia a condições como esquizofrenia e até autismo nas crianças.']","['Pesquisas têm associado idade do homem a problemas na gestação e no bebê - Estadão', 'Pesquisas têm associado idade do homem a problemas na gestação e no bebê', ""'Fertilidade é um esporte de equipe e ambos os jogadores são importantes', diz o professor de Urologia Michael Eisenberg, da Universidade Stanford (EUA)"", 'aos 30 ou aos 50? A diferença pode parecer, até hoje, apenas uma questão de disposição para carregar a cria nos ombros ou estabilidade financeira para pagar as mensalidades do colégio. Mas não é só. Cada vez mais, pesquisas têm demonstrado que a idade do homem (e não só a da mulher) tem impacto na', ', risco de baixo peso do bebê e problemas logo após o nascimento ou na infância. Também encontraram elo entre pais mais velhos e', 'gestacional. A mensagem é cada vez mais clara. “Fertilidade é um esporte de equipe e ambos os jogadores são importantes”, disse ao', 'Um dos estudos recentes de maior importância na área é o trabalho liderado por Eisenberg, publicado em 2018, que analisou 40,5 milhões de nascimentos em uma década nos Estados Unidos. Controlada a idade materna, mediu-se o impacto da idade dos pais na saúde dos filhos. Bebês nascidos de pais com mais de 35 anos tinham risco maior de baixo peso, convulsões e necessidade de ventilação logo após o parto.', 'Segundo a pesquisa, quanto maior a idade do pai, maior o risco. Homens com 45 anos ou mais tinham, por exemplo, 14% mais probabilidade de ter um filho prematuro em comparação com pais entre 25 e 34 anos. E o risco de ter diabete gestacional para mulheres com parceiros mais velhos era 28% maior.', 'Artigo publicado em março por pesquisadoras da Universidade Rutgers, em Nova Jersey (EUA), reuniu informações deste e de outros 22 estudos. Além de problemas ao nascer, pesquisas compiladas haviam associado a paternidade tardia a condições como esquizofrenia e até autismo nas crianças.', 'A relação de causa entre a idade do pai e as complicações ainda não é clara. Como os espermatozoides são produzidos nos testículos continuamente (ao contrário dos óvulos, que envelhecem), acreditava-se que a idade do homem não influenciava na gravidez. Hoje, hipóteses como o tempo de exposição a infecções e a possibilidade de fragmentação do DNA ao longo dos anos são levantadas para explicar o problema.', '“Os homens não estão conscientes sobre as questões de envelhecimento e fertilidade”, diz Gloria Bachmann, diretora do Instituto da Saúde da Mulher, da Universidade Rutgers. Para reduzir riscos aos bebês e à gestação, ela sugere o congelamento de sêmen a homens que querem adiar a paternidade, mas reconhece barreiras como custo e dificuldade em delimitar a idade a partir da qual se recomenda a técnica.', 'Hoje, no Brasil, é baixo o número de homens que buscam o congelamento de sêmen apenas por causa da idade. Diretora do banco de sêmen Pró-Seed, Vera Fehér Brand estima que cerca de 8% dos pacientes que procuram a clínica têm exclusivamente essa intenção. “Médicos falam pouco sobre isso e os homens, em geral, não vão atrás dessa informação.” O congelamento de sêmen por um ano na Pró-Seed custa, em média, R$ 1,1 mil.', 'Coordenador de Reprodução da Sociedade Brasileira de Urologia (SBU), Marcelo Vieira diz que o tema despertou discussões no último congresso da Sociedade Europeia de Reprodução Humana e Embriologia. Há controvérsia sobre o congelamento de sêmen. “Será que não é hora de voltar a um passado não tão distante e ter filhos na época mais adequada?”', 'Para Jorge Hallak, do Grupo de Estudos em Saúde Masculina do Instituto de Estudos Avançados da Universidade de São Paulo (USP), o tema esbarra em lacunas na educação dos homens. “Ele confunde o fato de ter ereção e ejacular com ser fértil.” Contra a desinformação, ele participa de campanhas em escolas. “Preconizamos que o paciente se habitue a ir ao andrologista a partir dos 13 anos. O homem tem de começar a assumir a paternidade responsável, a parte reprodutiva, para sim ou para não.”', 'Segundo Nilka Donadio, presidente da Sociedade Brasileira de Reprodução Humana, é comum que dificuldades reprodutivas dos homens cheguem primeiro ao conhecimento do ginecologista que acompanha a parceira. “O homem tem mais medo do problema reprodutivo. Mistura-se um pouco fertilidade com masculinidade”, diz.']"
"https://saude.estadao.com.br/noticias/geral,com-varios-vetos-bolsonaro-sanciona-lei-antidrogas,70002858546",0,50,"['""O Jeferson tinha esquizofrenia e não aderia às comunidades terapêuticas, que são abertas e ele fugia. Ele começou a usar maconha em 2007 e, já no começo, teve um quadro de surto.""']","['Bolsonaro sanciona lei que permite internação de dependente químico sem consentimento - Estadão', 'Bolsonaro sanciona lei que permite internação de dependente químico sem consentimento', 'Internação involuntária agora está prevista e facilitada na lei; texto diz que ela se dará a pedido de familiar ou responsável legal', 'sancionou nesta quinta-feira, 6,\xa0 a nova política nacional de drogas, que prevê e facilita a internação involuntária (sem consentimento) de usuários de', 'por até três meses. Entre os vetos, destaca-se a retirada do dispositivo que afrouxava a pena para pessoas detidas com pequena quantidade de entorpecente.\xa0As', ', incentivadas na proposta e normalmente ligadas a grupos religiosos, só poderão receber pacientes voluntários.', 'Na legislação de 2006, não havia previsão de internação involuntária. Ela só era prevista na Lei 10.216, de 2001, que detalha o modelo de saúde mental, e prevê três tipos de internação: a voluntária, quando a pessoa se interna por conta própria; a compulsória, quando isso ocorre por ordem judicial; e a involuntária, quando ela é internada contra sua vontade, por se entender que ela põe em risco a própria vida ou a de outros.', 'Agora, a internação involuntária perdurará apenas pelo tempo necessário à desintoxicação, tendo seu término determinado pelo médico responsável. No entanto, a nova lei permite à família ou ao representante legal, a qualquer tempo, requerer ao médico a interrupção do tratamento. “A internação, em quaisquer de suas modalidades, só será indicada quando os recursos extra-hospitalares se mostrarem insuficientes”, diz a lei. “Todas as internações e altas deverão ser informadas, em no máximo 72 horas, ao Ministério Público, à Defensoria e a outros órgãos de fiscalização.”', 'Lei Antidrogasprevê e facilita a internação involuntária de usuários de drogas', 'Pela nova legislação, a remoção do paciente contra a vontade ocorrerá a pedido de familiar ou do responsável legal ou, na absoluta falta deste, de servidor público da área de saúde, da assistência social ou dos órgãos públicos integrantes do Sistema Nacional de Políticas Públicas sobre Drogas (Sisnad), com exceção de servidores da área de segurança pública. A internação involuntária só deverá ocorrer após a formalização da decisão por médico responsável e será indicada após avaliação sobre o tipo de droga utilizada.', 'Veta-se, porém, a realização de internações compulsórias ou involuntárias “nas comunidades terapêuticas acolhedoras” – o que vinha ocorrendo em alguns casos. Há cerca de 1,8 mil desses centros de reabilitação pelo País, que em sua maioria funcionam com base em cultos de fé, terapia pelo trabalho e abstinência.', '“A comunidade terapêutica é mais uma opção oferecida porque antes a área de saúde mental do', 'proibia a comunidade terapêutica, era contra, e achamos que, se seguir protocolo adequado, tiver critérios técnicos e acompanhamento médico, funciona muito bem”, afirmou o ministro da Cidadania,', 'Autor do projeto na Câmara, em 2013, Terra destacou que o processo de desintoxicação deverá ocorrer obrigatoriamente em hospitais. “É para aquele menino que está lá, que nem consegue conversar, está vendendo o corpo por uma pedra, está no desespero total na Cracolândia, em casa, vendendo tudo.” Apesar do prazo de até 90 dias, ressaltou que a internação involuntária em hospital dura, em média, 21 dias.', 'Por questões econômicas, ele também apoiou o veto do presidente à possibilidade de comunidades terapêuticas receberem isenção fiscal. Caso esse trecho fosse sancionado, pessoas e empresas poderiam destinar até 30% do Imposto de Renda para as instituições. “Acho que estamos cheios de isenção fiscal”, disse o ministro. “Precisamos que se tenha recurso público para garantir o básico do tratamento. Os vetos ajudaram o projeto, não enfraqueceram. Ficou de bom tamanho.”', 'Segundo Terra, alguns pontos barrados poderão ser avaliados posteriormente e contemplados por meio de decreto. Entre eles, o veto ao artigo que definia a composição do Sisnad, no trecho que incluía formalmente comunidades terapêuticas. Veja aqui a', ', da Prefeitura de São Paulo, tem realizado internações voluntárias na capital. A questão da internação involuntária ainda será discutida, segundo o médico psiquiatra Arthur Guerra, coordenador do programa.', '""O que nós oferecemos foram as internações e fomos surpreendidos com 10 mil internações voluntárias. Nossos próximos passos serão: ter uma integração forte e maior entre Estado e município, fazer uma aproximação com o Governo Federal para que a gente possa entender melhor a política e ter um sistema de avaliação desse trabalho, com pesquisas qualitativas.""', 'Entre 26 de maio de 2017 e esta quinta-feira, 6, foram realizados 16.342 atendimentos, dos quais 10.031 foram internações voluntárias, de acordo com a gestão municipal.', 'Foram realizados ainda 371 encaminhamentos para leitos de prontos-socorros e hospitais municipais e gerais, 292 para Centros de Atenção Psicossocial Álcool e outras Drogas (CAPS-AD), 14 para o Centro de Referência de Álcool, Tabaco e Outras Drogas (Cratod) e 565 para a rede de atendimentos sociais.', 'é uma ""área central da questão de drogas e das internações"". Ele diz que, em 2017, a população de usuários flutuava entre 2.500 e 4 mil na região - os picos eram nos finais de semana.', '""Este número está por volta de 420 usuários. Hoje, não resolvemos o assunto, mas temos a chance de trabalhar com números menores. Nossa meta é diminuir em 80%.""', 'No Rio, em 2009, quando Eduardo Paes (DEM) era prefeito, o carro-chefe de sua administração foi a Operação Choque de Ordem – que incluía a internação involuntária de usuários de droga. Houve críticas de que a política era higienista e a ação durou só 15 meses.', 'Hoje, vigoram os três tipos de internação, mas a política atual é focada na redução de danos, que privilegia as ações de prevenção e as internações voluntárias.', ', do governo do Estado, registrou a desintoxicação de 18,5 mil pessoas, sendo 71% de caráter voluntário. Foram feitas 13,2 mil internações voluntárias, 5,2 mil involuntárias e 34 compulsórias.', 'No mesmo período, o Recomeço encaminhou 29,9 mil pacientes a Centros de Atenção Psicossocial (Caps) e 6,8 mil para acolhimento em comunidades terapêuticas. ""Cabe lembrar que a internação de dependentes químicos só é indicada para casos mais graves, conforme avaliação médica, cabendo também aos profissionais avaliarem o período, conforme cada caso"", informou o governo.', 'Os demais pacientes, informa, devem ser acompanhados ambulatorialmente nos Centros de Atenção Psicossocial - Álcool e Drogas (Caps AD) das prefeituras. Segundo a gestão estadual, o programa Recomeço parte de três premissas: acolhimento com escuta qualificada, tratamento ambulatorial/hospitalar e reinserção social, de forma interligada e individualizada para cada paciente.', 'A estudante de Serviço Social Janicleide de Araújo Xavier, de 46 anos, foi uma das primeiras pessoas a buscar internação involuntária para o filho quando o atendimento passou a ser oferecido pelo Cratod, serviço do governo do Estado de São Paulo, em 2013.', '""O Jeferson tinha esquizofrenia e não aderia às comunidades terapêuticas, que são abertas e ele fugia. Ele começou a usar maconha em 2007 e, já no começo, teve um quadro de surto.""', 'Vício do filho fez Janicleide Xavier, 46 anos, recorrer à internação involuntária em 2013', 'Ao saber da possibilidade de internação involuntária, ela diz que acreditou na possibilidade\xa0de ver o filho livre do vício. ""Ele fez em torno de cinco internações involuntárias a partir de 2013. É uma coisa positiva, porque muitas mães querem ajudar os filhos. Quando a pessoa está em uso de drogas, está em risco e não sabe. Meu filho voltava muito melhor das internações. Saía pensando em trabalhar, estudar, ser modelo, namorar.""', 'A última internação foi em 2017, quando ele ficou em Itapira, no interior paulista. Menos de um mês após sair da internação, o jovem, então com 27 anos, apresentou problemas nos brônquios e foi atendido em uma Unidade de Pronto Atendimento (UPA), de onde fugiu.', '""Ele passou a madrugada caminhando. Comprou remédio, usou crack e desmaiou. Ele foi socorrido e deu entrada no hospital com parada cardiorrespiratória.""', 'Três dias depois, Janicleide, que pensava que o filho estava desaparecido, fez o reconhecimento do corpo dele no Instituto Médico Legal (IML). Apesar da perda, ela diz que o atendimento foi importante para o rapaz. ""Essas internações, mesmo contra a vontade, ajudaram o meu filho. Ele fazia uso de cocaína e crack. Quando morreu, estava 80% limpo.""']"
"https://saude.estadao.com.br/noticias/geral,inteligencia-do-psicopata-e-criacao-mistica-e-mentirosa-diz-especialista,70002804864",0,51,"['. Num sentido estritamente médico, como falamos de pneumonia, meningite, não é uma doença. O que chamamos de doenças mentais, como esquizofrenia e depressão, são distúrbios pontuais. No caso da psicopatia, é um distúrbio de personalidade, não algo pontual. Agora, se consideramos a doença como uma condição biológica que te deixa em desvantagem, aí podemos dizer que sim, é uma doença.', 'Este é um debate atual acirrado. Eu pessoalmente não acredito nisso. Todos os psicopatas sabem a diferença entre o certo e o errado por isso podem ser responsabilizados criminalmente. É diferente de um esquizofrênico, por exemplo, que está delirando e ouve uma voz que o manda matar um sujeito. Ele está em surto. O psicopata, não. Ele sabe, não é psicótico. E tem outra coisa, o fato de ter uma predisposição não justifica nada. Há um perigo no excesso de neurocientização da sociedade que é tentar explicar tudo pelo cérebro. Ora, o cérebro sozinho não faz nada.']","[""'Inteligência do psicopata é criação mística e mentirosa', diz especialista - Estadão"", ""'Inteligência do psicopata é criação mística e mentirosa', diz especialista"", 'Condição que tem como principal característica a ausência das emoções morais será tema de  conferência nesta sexta no Rio', 'O neurocientista Ricardo Oliveira da UniRio e do Instituto D´Or é um especialista na mente dos', 'morais (a culpa e a pena), é a principal característica dos psicopatas. Mas, garante, ao contrário do que mostram muitos filmes, os psicopatas não são especialmente inteligentes.“Isso não é verdade”, disse, em entrevista ao', '. “Uma minoria pequeniníssima é inteligente, mas são esses que sobressaem.”', 'O distúrbio afeta 3% dos homens e menos de 1% das mulheres. Oliveira fala nesta sexta-feira, 26,\xa0sobre o tema na Rio2C, a conferência sobre inovação na Cidade das Artes, na Barra da Tijuca, na zona oeste.', 'É uma coleção de achados. Entre os mais importantes estão a redução ou ausência das emoções morais – que são, essencialmente, a culpa e a pena, que formam a base da moral. Depois temos algumas outras características, mas que podem variar muito de pessoa para pessoa. Mentiras repetidas, a incapacidade de manter ocupações regulares (como escola e trabalho). Mas é importante deixar claro o seguinte: é preciso ter muito cuidado com isso, ou qualquer desafeto passa a ser um ‘psicopata’. A psicopatia é um diagnóstico altamente técnico, não é intuitivo.', '. Num sentido estritamente médico, como falamos de pneumonia, meningite, não é uma doença. O que chamamos de doenças mentais, como esquizofrenia e depressão, são distúrbios pontuais. No caso da psicopatia, é um distúrbio de personalidade, não algo pontual. Agora, se consideramos a doença como uma condição biológica que te deixa em desvantagem, aí podemos dizer que sim, é uma doença.', 'Não, não tem. Houve algumas tentativas, mas nada consistente. Mas há um outro grupo, o dos sociopatas, que é composto por indivíduos antissociais, mas que não têm a frieza, a ausência de emoções morais dos psicopatas, ou seja, não são casos tão graves. Essas pessoas, com psicoterapia e algumas modificações no ambiente, podem se endireitar, ter uma vida adaptada e produtiva. Mas, lembrando, eles têm as emoções morais.', 'Isso é mentira. Existe essa mística de que o psicopata é inteligente. Mas não é verdade. A grande maioria é mau aluno, tem uma carreira acadêmica precária, briga com todo mundo, não consegue parar em nenhum emprego. Os psicopatas institucionais, os de colarinho branco, podem ficar alguns anos no topo, mas acabam caindo por causa do distúrbio. Ele dá tanto golpe que acaba sendo pego.', 'Não, isso é parte da mesma mística de que são inteligentes. Uma minoria pequeníssima é inteligente, ainda bem, mas são esses que acabam aparecendo mais.', 'A psicopatia, ou essa ausência das emoções morais, tem uma origem genética?', 'As emoções são criadas no cérebro, mas existe um determinismo genético sim, de mais de 60%. Da mesma forma que a variação de altura, da cor dos olhos, da cor da pele, a gente sabe hoje que as coisas psíquicas têm uma contribuição genética muito forte.', 'Mas isso quer dizer que eles não podem ser responsabilizados pelo que fazem?', 'Este é um debate atual acirrado. Eu pessoalmente não acredito nisso. Todos os psicopatas sabem a diferença entre o certo e o errado por isso podem ser responsabilizados criminalmente. É diferente de um esquizofrênico, por exemplo, que está delirando e ouve uma voz que o manda matar um sujeito. Ele está em surto. O psicopata, não. Ele sabe, não é psicótico. E tem outra coisa, o fato de ter uma predisposição não justifica nada. Há um perigo no excesso de neurocientização da sociedade que é tentar explicar tudo pelo cérebro. Ora, o cérebro sozinho não faz nada.']"
"https://ciencia.estadao.com.br/noticias/geral,circuitos-cerebrais-das-emocoes-surgem-antes-de-o-bebe-completar-um-ano,70002542719",0,52,"['O trabalho foi feito com base nas imagens cerebrais de 223 recém-nascidos. Os cientistas olharam especificamente para o centro de processamento de emoções no cérebro, a região conhecida como amígdala, e suas conexões com outras áreas do cérebro relacionadas às emoções. Processamentos atípicos na amígdala estão ligados a desordens como depressão, ansiedade e esquizofrenia em adultos.']","['Circuitos cerebrais das emoções surgem antes de o bebê completar 1 ano - Estadão', 'Estudo indica que é possível identificar cedo crianças em risco de apresentarem desordens comportamentais e psiquiátricas', 'RIO - Os circuitos cerebrais que regulam as emoções surgem bem cedo, muito antes do que se imaginava. Estudo publicado na', 'completar um ano. O desenvolvimento desses circuitos no segundo ano de vida predizem o quociente de inteligência (QI) e o controle emocional do indivíduo na idade adulta. O trabalho sugere que é possível identificar, desde muito cedo, crianças em risco de apresentarem desordens comportamentais e', 'As novas descobertas oferecem uma pista sobre em que momento o desenvolvimento atípico pode determinar o surgimento de problemas emocionais e cognitivos na vida adulta', 'Conversar com bebês é a melhor maneira de incentivar desenvolvimento da linguagem', '""Pelas lentes da ressonância magnética, o estudo mostra que os circuitos cerebrais essenciais para uma regulação emocional bem-sucedida em adultos não existem nos recém-nascidos, mas se desenvolve no primeiro e segundo anos de vida, provendo as bases do desenvolvimento emocional"", explicou, no estudo, o autor Wei Gao, do Hospital Cedars-Sinai, de Los Angeles, lembrando que os recém-nascidos contam com um outro tipo de circuito que desaparece tão logo as conexões adultas se estabelecem.', 'A taxa de crescimento das conexões emocionais durante o segundo ano de vida indica os níveis de ansiedade que a criança pode vir a apresentar aos quatro anos. Essa taxa também pode indicar o QI da criança, determinando o desenvolvimento do controle emocional na idade adulta e também a cognição.', '""Esse estudo revela o rápido avanço que estamos testemunhando no uso de imagens funcionais do cérebro para entender o desenvolvimentos das conexões cerebrais na primeira infância"", escreveu o editor da', ', Cameron Carter. ""Os resultados chamam a atenção para a importância de se compreender o desenvolvimento das trajetórias das funções cerebrais para prever as diferenças de funcionamento emocional dos indivíduos.""', 'O trabalho foi feito com base nas imagens cerebrais de 223 recém-nascidos. Os cientistas olharam especificamente para o centro de processamento de emoções no cérebro, a região conhecida como amígdala, e suas conexões com outras áreas do cérebro relacionadas às emoções. Processamentos atípicos na amígdala estão ligados a desordens como depressão, ansiedade e esquizofrenia em adultos.', 'As novas descobertas oferecem uma pista sobre em que momento esse desenvolvimento atípico pode determinar o surgimento de problemas emocionais e cognitivos na vida adulta.', '""As descobertas sugerem que pode ser possível, no futuro, identificar as crianças em maior risco de apresentar dificuldades comportamentais associadas com desordens psiquiátricas na primeira infância, permitindo uma intervenção precoce para reduzir o risco do surgimento de problemas"", afirmou o coautor John Gilmore, ao divulgar a pesquisa.']"
